{
  "pack_id": "base",
  "pack_version": "0.4.0-dev",
  "schema_version": 2,
  "game_version_range": ">=0.4.0-dev <1.0.0",
  "dependencies": [],
  "load_order": 0,
  "content_manifest": [
    "content/archetype_profiles.json",
    "content/blessings.json",
    "content/character_runtime_profiles.json",
    "content/characters.json",
    "content/curses.json",
    "content/items.json",
    "content/talents.json",
    "content/time_abilities.json",
    "content/weapon_runtime_profiles.json",
    "content/weapons.json"
  ],
  "localization_sources": [
    "localization/translations.csv"
  ],
  "asset_manifest": [],
  "integrity_hashes": {
    "content/archetype_profiles.json": "9bb211b494e9187ae7eff4d674a4bcdadef24d256856f99b094c735a7b33c067",
    "content/blessings.json": "aa9863cd56e8fff4c5601b2adfbb2cc906bd64fe8fbd62019f02519f0d3a4f26",
    "content/character_runtime_profiles.json": "c1d148fee2a0ab2d79efc14aeb684c3ea4b2e6954b830a75cc8dee14058bc3ff",
    "content/characters.json": "8fd8aef62d60112cc0db8600e76e7c9ba9f9a1cbbfec7a1d007a834413ce8f3a",
    "content/curses.json": "182bab81b4739950ace61f42b669cc901a33152dae0bf3a5e89b6a0d993cc9a9",
    "content/items.json": "629cf16f94ad5783b55bc2679064bfeecf75f04ec76cc551a21eedf8411e0f25",
    "content/talents.json": "8ed24bbcf544f8aa165316ed603e5e6f72d2e8c2e915494bcc1701389f9abb13",
    "content/time_abilities.json": "33401f7d8a9fd5fdb705e51b3eb287ab8d995fe6b2f6f3049ab2c21cb9e76a15",
    "content/weapon_runtime_profiles.json": "e9d17db1458bc5b2ea5372d446c7d53c699c377a6d2d1a67316e9a7181808d40",
    "content/weapons.json": "e97d8e4aa3fa276a9058800fb0b9f5cbe497201cc066e1a0d5da3d549a1afd8a",
    "localization/translations.csv": "6fbf97b800cd3ee9684e0ddfaf1332b580d89de53376f4426703a1c5af38662d"
  },
  "entitlement_tag": ""
}
