{
  "pack_id": "fixture_chain_mod",
  "pack_version": "1.0.0",
  "schema_version": 2,
  "game_version_range": ">=0.4.0-dev <1.0.0",
  "dependencies": [
    {
      "pack_id": "fixture_chain_update",
      "version_range": ">=1.1.0 <2.0.0",
      "required": true
    }
  ],
  "load_order": 0,
  "content_manifest": [],
  "localization_sources": [],
  "asset_manifest": [],
  "integrity_hashes": {},
  "entitlement_tag": ""
}
