{
  "pack_id": "fixture_base",
  "pack_version": "1.0.0",
  "schema_version": 2,
  "game_version_range": ">=0.4.0-dev <1.0.0",
  "dependencies": [],
  "load_order": 0,
  "content_manifest": [
    "content/items.json"
  ],
  "localization_sources": [],
  "asset_manifest": [],
  "integrity_hashes": {
    "content/items.json": "572c8d44b285f34069ba9ae3c29b0c0fec646bb464cc1867202190af9c6fbb3e"
  },
  "entitlement_tag": ""
}
